[
  {
    "stepNumber": 1,
    "id": "safety-first",
    "urgency": "immediate",
    "title": {
      "en": "Pause & Ensure Safety",
      "hi": "रुकें और सुरक्षा सुनिश्चित करें",
      "mr": "थांबा आणि सुरक्षितता सुनिश्चित करा"
    },
    "summary": {
      "en": "You are not alone. Do not blame yourself. Do not pay extortion demands, and do not delete evidence messages yet.",
      "hi": "आप अकेले नहीं हैं। खुद को दोष न दें। ब्लैकमेलर को पैसे न दें, और सबूत वाले संदेशों को अभी डिलीट न करें।",
      "mr": "तुम्ही एकटे नाही आहात. स्वतःला दोष देऊ नका. खंडणीचे पैसे देऊ नका आणि पुरावे असणारे संदेश आत्ताच नष्ट करू नका."
    },
    "points": [
      {
        "en": "If you are in immediate physical danger, call emergency 112 right away.",
        "hi": "यदि आप तत्काल शारीरिक खतरे में हैं, तो तुरंत 112 पर कॉल करें।",
        "mr": "तुम्हाला त्वरित शारीरिक धोका असल्यास, लगेच ११२ वर कॉल करा."
      },
      {
        "en": "Paying extortionists rarely stops threats and usually invites larger demands.",
        "hi": "पैसे देने से ब्लैकमेलिंग रुकती नहीं, बल्कि वे और अधिक पैसों की मांग करने लगते हैं।",
        "mr": "पैसे दिल्याने खंडणी थांबत नाही, उलट अधिक मागणी केली जाते."
      },
      {
        "en": "Do not delete chats, voice notes, or threatening messages — they are vital legal proof.",
        "hi": "धमकी भरे चैट, वॉइस नोट या संदेश डिलीट न करें — वे कानूनी सबूत हैं।",
        "mr": "धमकीचे चॅट, व्हॉईस नोट्स किंवा मेसेज डिलीट करू नका — ते महत्त्वाचे कायदेशीर पुरावे आहेत."
      }
    ]
  },
  {
    "stepNumber": 2,
    "id": "preserve-evidence",
    "urgency": "high",
    "title": {
      "en": "Preserve Evidence Without Storing Images",
      "hi": "छवियों को सेव किए बिना सबूत सुरक्षित करें",
      "mr": "छायाचित्रे जतन न करता पुरावे सुरक्षित करा"
    },
    "summary": {
      "en": "Record URLs, usernames, phone numbers, and compute secure SHA-256 hashes on your device.",
      "hi": "URL, यूजरनेम, फोन नंबर रिकॉर्ड करें और अपने डिवाइस पर सुरक्षित SHA-256 हैश बनाएं।",
      "mr": "URL, युझरनेम, फोन नंबर नोंदवा आणि आपल्या डिव्हाइसवर सुरक्षित SHA-256 हॅश तयार करा."
    },
    "points": [
      {
        "en": "Copy the exact web links (URLs) where the content or profile appears.",
        "hi": "उस सटीक वेब लिंक (URL) को कॉपी करें जहाँ सामग्री या प्रोफाइल दिखाई दे रही है।",
        "mr": "सामग्री किंवा प्रोफाईल जिथे दिसत आहे त्याची अचूक वेब लिंक (URL) कॉपी करा."
      },
      {
        "en": "Never upload or store intimate photos inside this app. Only save metadata and file hashes.",
        "hi": "इस ऐप में कभी भी अंतरंग फोटो अपलोड या सेव न करें। केवल मेटाडेटा और फाइल हैश सुरक्षित करें।",
        "mr": "या ॲपमध्ये कधीही खाजगी फोटो अपलोड किंवा सेव्ह करू नका. फक्त मेटाडेटा आणि फाईल हॅश सुरक्षित ठेवा."
      },
      {
        "en": "Keep screenshot files safely backed up on an offline USB or secure private folder.",
        "hi": "स्क्रीनशॉट फाइलों को किसी ऑफलाइन पेनड्राइव या सुरक्षित निजी फोल्डर में सुरक्षित रखें।",
        "mr": "स्क्रीनशॉट फाइल्स ऑफलाइन पेनड्राइव्ह किंवा सुरक्षित खाजगी फोल्डरमध्ये जपून ठेवा."
      }
    ]
  },
  {
    "stepNumber": 3,
    "id": "send-24h-notice",
    "urgency": "critical",
    "title": {
      "en": "Send 24-Hour Takedown Complaint",
      "hi": "24 घंटे का सामग्री हटाने का नोटिस भेजें",
      "mr": "२४ तासांची सामग्री हटवण्याची नोटीस पाठवा"
    },
    "summary": {
      "en": "Generate a compliant legal notice citing Rule 3(2)(b) of the IT Rules 2021 and submit it to the platform.",
      "hi": "आईटी नियम 2021 के नियम 3(2)(ख) का हवाला देते हुए एक वैध कानूनी नोटिस बनाएं और मंच को भेजें।",
      "mr": "आयटी नियम २०२१ च्या नियम ३(२)(b) चा संदर्भ देऊन कायदेशीर नोटीस तयार करा आणि प्लॅटफॉर्मला पाठवा."
    },
    "points": [
      {
        "en": "Indian law requires platforms to remove non-consensual sexual/intimate content within 24 hours of notification.",
        "hi": "भारतीय कानून के अनुसार सोशल मीडिया प्लेटफॉर्म को सूचना मिलने के 24 घंटे के भीतर गैर-सहमति यौन सामग्री हटानी होगी।",
        "mr": "भारतीय कायद्यानुसार सोशल मीडिया प्लॅटफॉर्मने सूचना मिळाल्यापासून २४ तासांत संमती नसलेली लैंगिक सामग्री हटवणे बंधनकारक आहे."
      },
      {
        "en": "Use our ready-to-copy legal template containing mandatory statutory statements.",
        "hi": "अनिवार्य वैधानिक कथनों वाले हमारे तैयार कानूनी टेम्पलेट का उपयोग करें।",
        "mr": "अनिवार्य कायदेशीर विधाने असलेले आमचे तयार कायदेशीर टेम्पलेट वापरा."
      },
      {
        "en": "Save the complaint reference number / ticket ID as soon as the platform confirms receipt.",
        "hi": "जैसे ही प्लेटफॉर्म प्राप्ति की पुष्टि करे, शिकायत संदर्भ संख्या / टिकट आईडी सुरक्षित करें।",
        "mr": "प्लॅटफॉर्मने पोच पावती देताच तक्रार संदर्भ क्रमांक / तिकीट आयडी नोंदवून ठेवा."
      }
    ]
  },
  {
    "stepNumber": 4,
    "id": "track-deadline",
    "urgency": "normal",
    "title": {
      "en": "Start 24-Hour Timer & Set Alerts",
      "hi": "24 घंटे का टाइमर शुरू करें और अलर्ट सेट करें",
      "mr": "२४ तासांचा टाइमर सुरू करा आणि अलर्ट सेट करा"
    },
    "summary": {
      "en": "Track the exact minute when the intermediary must comply and prepare calendar reminders.",
      "hi": "उस सटीक समय को ट्रैक करें जब तक प्लेटफॉर्म को कार्रवाई करनी है और कैलेंडर रिमाइंडर सेट करें।",
      "mr": "प्लॅटफॉर्मने कारवाई करण्याच्या अचूक वेळेचा मागोवा घ्या आणि कॅलेंडर स्मरणपत्र सेट करा."
    },
    "points": [
      {
        "en": "The 24-hour statutory clock starts from the moment of complaint submission.",
        "hi": "शिकायत जमा करने के क्षण से 24 घंटे की वैधानिक समय-सीमा शुरू होती है।",
        "mr": "तक्रार दाखल केल्याच्या क्षणापासून २४ तासांची कायदेशीर वेळ सुरू होते."
      },
      {
        "en": "Download the calendar reminder file (.ics) to notify you when the deadline expires.",
        "hi": "समय-सीमा समाप्त होने पर आपको सचेत करने के लिए कैलेंडर फाइल (.ics) डाउनलोड करें।",
        "mr": "मुदत संपल्यावर सूचना मिळण्यासाठी कॅलेंडर फाइल (.ics) डाउनलोड करा."
      },
      {
        "en": "Re-check the links at the 24-hour mark to verify if the content has been removed or disabled.",
        "hi": "यह देखने के लिए कि क्या सामग्री हटा दी गई है, 24 घंटे पूरे होने पर लिंक फिर से जांचें।",
        "mr": "सामग्री काढली गेली आहे की नाही हे तपासण्यासाठी २४ तासांनंतर लिंक पुन्हा तपासा."
      }
    ]
  },
  {
    "stepNumber": 5,
    "id": "escalate-authorities",
    "urgency": "high",
    "title": {
      "en": "Escalate to GAC, NCRP 1930 & Police",
      "hi": "GAC, NCRP 1930 और पुलिस में शिकायत आगे बढ़ाएं",
      "mr": "GAC, NCRP १९३० आणि पोलिसांकडे तक्रार वाढवा"
    },
    "summary": {
      "en": "If the platform ignores the 24h deadline or if threats/extortion occur, lodge formal criminal complaints.",
      "hi": "यदि प्लेटफ़ॉर्म 24 घंटे में कार्रवाई नहीं करता या फिर जबरन वसूली/धमकी दी जाती है, तो औपचारिक शिकायत दर्ज करें।",
      "mr": "जर प्लॅटफॉर्मने २४ तासांत कारवाई केली नाही किंवा खंडणी/धमकी दिली गेली, तर औपचारिक गुन्हेगारी तक्रार नोंदवा."
    },
    "points": [
      {
        "en": "Call the Cybercrime Helpline at 1930 or submit at cybercrime.gov.in under 'Report Women/Child Related Crime'.",
        "hi": "साइबर अपराध हेल्पलाइन 1930 पर कॉल करें या cybercrime.gov.in पर 'महिला/बाल अपराध रिपोर्ट' में दर्ज करें।",
        "mr": "सायबर गुन्हे हेल्पलाईन १९३० वर कॉल करा किंवा cybercrime.gov.in वर 'महिला/बाल गुन्हे रिपोर्ट' अंतर्गत नोंदवा."
      },
      {
        "en": "Export your clean, printable Case Summary from this app to submit as an attachment.",
        "hi": "संलग्नक के रूप में जमा करने के लिए इस ऐप से अपनी केस समरी का प्रिंट निकालें।",
        "mr": "पुराव्यासाठी जोडण्यासाठी या ॲपमधून केस समरीची स्वच्छ प्रत प्रिंट करा."
      },
      {
        "en": "The SHA-256 hash log proves timestamps and content identifiers were recorded consistently.",
        "hi": "SHA-256 हैश लॉग यह साबित करता है कि समय और विवरण में कोई बाद में फेरबदल नहीं किया गया।",
        "mr": "SHA-256 हॅश लॉग हे सिद्ध करतो की वेळ आणि तपशिलांमध्ये नंतर कोणताही बदल केलेला नाही."
      }
    ]
  }
]

